qid,site,visits,subject
47367,https://ask.openstack.org/en/question/47367/how-to-install-juno-release-from-ubuntu-cloud-archive/,529, how to install juno release from
44071,https://ask.openstack.org/en/question/44071/is-it-possible-to-launch-instance-based-on-parameter-passed-to-the-heat-template/,492, is it possible to launch instance
44383,https://ask.openstack.org/en/question/44383/all-in-one-how-to-set-up-a-virtual-external-network-completely-inclosed-within-the-host/,375, all in one how to set
43214,https://ask.openstack.org/en/question/43214/worlddumppy-error-argument-d-idr-expected-one-argument-homedevstackdevstackprereqs-permission-denied/,304, worlddumppy error argument d idr expected
47065,https://ask.openstack.org/en/question/47065/moving-vms-from-vsphere-to-openstack-to-be-still-used-in-vmdk-format/,291, moving vms from vsphere to openstack
33589,https://ask.openstack.org/en/question/33589/validating-and-installing-os-ksec2-admin-extension/,281, validating and installing os ksec2 admin
35705,https://ask.openstack.org/en/question/35705/attempt-of-rdo-aio-install-icehouse-on-centos-7/,275, attempt of rdo aio install icehouse
44423,https://ask.openstack.org/en/question/44423/cannot-ping-router-tenant-gateway-by-os-nodes-and-www-by-instance/,264, cannot ping router tenant gateway by
43335,https://ask.openstack.org/en/question/43335/was-someone-able-to-install-hp-helion-virtual-install-on-virtual-machine/,247, was someone able to install hp
44352,https://ask.openstack.org/en/question/44352/where-to-get-openstacks-response-json-schema/,229, where to get openstacks response json
