qid,site,visits,subject
50611,https://ask.openstack.org/en/question/50611/nova-list-error-httpconnectionpoolhostcontroller-port8774-max-retries-exceeded-with-url-v2c677d3d3c35644579fa8da9b4342e19dserversdetail-caused-by/,1027, nova list error httpconnectionpoolhostcontroller port8774 max
51150,https://ask.openstack.org/en/question/51150/how-to-extend-the-time-allowed-for-overcloud-create/,892, how to extend the time allowed
54015,https://ask.openstack.org/en/question/54015/mongodbpp-error-when-installing-rdo-on-centos-7/,830, mongodbpp error when installing rdo on
51440,https://ask.openstack.org/en/question/51440/authentication-failed-when-setting-up-two-region-openstack-deployment-using-devstack/,700, authentication failed when setting up two
56047,https://ask.openstack.org/en/question/56047/neutron-namespace-not-getting-updated-until-neutron-server-is-restarted/,563, neutron namespace not getting updated until
54069,https://ask.openstack.org/en/question/54069/rdo-installation-problem-on-centos-7-because-of-mongodb/,556, rdo installation problem on centos 7
51180,https://ask.openstack.org/en/question/51180/error-connectionerror-httpconnectionpoolhostopenstack-port8774-max-retries-exceeded-with-url-v24ca42a660b0c4ff48db51d3187215dd4imagesdetail-caused-by/,478, error connectionerror httpconnectionpoolhostopenstack port8774 max retries
51013,https://ask.openstack.org/en/question/51013/rdo-deploy-openstack-error-execution-of-usrbinyum-d-0-e-0-y-list-erlang-returned-1-error-no-matching-packages-to-list/,420, rdo deploy openstack error execution of
54462,https://ask.openstack.org/en/question/54462/devstack-not-starting-because-of-urllib3connectionpool-httpconnectionpool-is-full-discarding-connection/,402, devstack not starting because of urllib3connectionpool
56848,https://ask.openstack.org/en/question/56848/swift-change-replication-address/,398, swift change replication address
